{
  "_id": "ds-aggregate",
  "is_enabled": true,
  "is_hidden": false,
  "label": "Aggregate",
  "scheme_id": "ds",
  "terms": [
    {
      "label": "Average",
      "name": "Average/Mean"
    },
    {
      "label": "Maximum"
    },
    {
      "label": "Median"
    },
    {
      "label": "Minimum"
    },
    {
      "label": "StandardDeviation",
      "name": "Standard Deviation"
    },
    {
      "label": "Cumulative"
    }
  ],
  "vocabulary_type": "class"
}